{
  "evaluation_id": "EVAL-0002",
  "target_type": "run_case",
  "target_id": "RUN-0002",
  "score": 100.0,
  "passed": true,
  "criteria_results": [
    {
      "criterion_id": "s2p_result_valid",
      "description": "S2P analysis result exists and reports no warnings",
      "passed": true,
      "score": 25.0,
      "notes": "s2p result exists and reports no warnings"
    },
    {
      "criterion_id": "constraint_result_valid",
      "description": "Constraint check result exists and all checks passed",
      "passed": true,
      "score": 25.0,
      "notes": "constraint result exists and all checks passed"
    },
    {
      "criterion_id": "evidence_candidates_relevant",
      "description": "RAG evidence has at least one candidate with relevance_score > 0",
      "passed": true,
      "score": 25.0,
      "notes": "at least one evidence candidate has relevance_score > 0 (max=0.273)"
    },
    {
      "criterion_id": "report_markdown_exists",
      "description": "Report markdown exists and is non-empty",
      "passed": true,
      "score": 25.0,
      "notes": "report markdown exists and is non-empty"
    }
  ],
  "created_at": "2026-07-12T07:57:36.855190Z"
}